{
  "override_path_templates": [
    "{project}/Overrides/{family}.md"
  ],
  "rules": [
    {
      "description": "Stack entrypoint is always required.",
      "human_owner": "{module}/tasks/start_here.md",
      "id": "entrypoint",
      "priority": 10,
      "requirements": [
        {
          "id": "start",
          "mode": "all_of",
          "paths": [
            "{module}/tasks/start_here.md"
          ],
          "phase": "before_first_mutation",
          "weight": 2
        }
      ],
      "risk": "baseline",
      "selectors": {
        "always": true
      }
    },
    {
      "description": "The fixture task requires scheduler ownership and causal attribution guidance.",
      "human_owner": "{module}/skills/scheduler_timers.md",
      "id": "scheduler_timers",
      "priority": 20,
      "requirements": [
        {
          "id": "owner",
          "mode": "all_of",
          "paths": [
            "{module}/skills/scheduler_timers.md"
          ],
          "phase": "before_first_mutation",
          "weight": 3
        }
      ],
      "risk": "high",
      "selectors": {
        "always": true
      }
    }
  ],
  "ruleset_hash": "8e4289ff6bf0570223d4b4524a062b9c3847a300cd605b5a8c93d4481a9dcf54",
  "ruleset_id": "xuunity.fixture.f7-attribution",
  "ruleset_version": "1.1.0",
  "schema_version": "xuunity.reduced-stack-rules.v1"
}
